{
  "$schema": "https://raw.githubusercontent.com/davidsteimer/fristenrechner/main/schemas/special-regime-catalog-v3.schema.json",
  "formatVersion": "3.0.0",
  "dataKind": "specialRegimeCatalog",
  "catalogId": "vrpg-be-special-regimes-ap17c",
  "profileId": "vrpg-be",
  "jurisdiction": {
    "level": "cantonal",
    "code": "BE"
  },
  "validity": {
    "dataValidFrom": "2026-08-30",
    "dataValidTo": null
  },
  "review": {
    "reviewedOn": "2026-09-12",
    "status": "candidate",
    "reviewedBy": "Codex",
    "basis": "AP17B fachlich durch David Steimer abgenommen. AP17C Integrationskandidat, Quellen am 12.09.2026 nachgeprüft, keine Daten- oder Betriebsfreigabe."
  },
  "scope": {
    "de": "AP17C: bisherige politische Regime und 16 begrenzte IVG-, AHVG-, UVG- und bernische Beschaffungszuordnungen. Neue Fallabdeckung 2026 bis 2027, Kandidat ohne Produktfreigabe.",
    "fr": "AP17C : régimes politiques existants et 16 rattachements limités LAI, LAVS, LAA et marchés publics bernois. Nouveaux cas couverts de 2026 à 2027, version candidate non publiée."
  },
  "sources": [
    {
      "sourceId": "SRC-VRPG-BE-20230801",
      "sourceType": "statute",
      "title": "Gesetz über die Verwaltungsrechtspflege, BSG 155.21",
      "authority": "Kanton Bern",
      "url": "https://www.belex.sites.be.ch/app/de/texts_of_law/155.21",
      "documentVersionDate": "2023-08-01",
      "reviewedOn": "2026-08-30",
      "reviewStatus": "verified"
    },
    {
      "sourceId": "SRC-PRG-BE-CURRENT",
      "sourceType": "statute",
      "title": "Gesetz über die politischen Rechte, BSG 141.1",
      "authority": "Kanton Bern",
      "url": "https://www.belex.sites.be.ch/app/de/texts_of_law/141.1",
      "documentVersionDate": null,
      "reviewedOn": "2026-08-30",
      "reviewStatus": "verified"
    },
    {
      "sourceId": "SRC-PRV-BE-CURRENT",
      "sourceType": "ordinance",
      "title": "Verordnung über die politischen Rechte, BSG 141.112",
      "authority": "Kanton Bern",
      "url": "https://www.belex.sites.be.ch/app/de/texts_of_law/141.112",
      "documentVersionDate": null,
      "reviewedOn": "2026-08-30",
      "reviewStatus": "verified"
    },
    {
      "sourceId": "SRC-BPR-20221023",
      "sourceType": "statute",
      "title": "Bundesgesetz über die politischen Rechte, SR 161.1",
      "authority": "Schweizerische Eidgenossenschaft",
      "url": "https://www.fedlex.admin.ch/eli/cc/1978/688_688_688/de",
      "documentVersionDate": "2022-10-23",
      "reviewedOn": "2026-08-30",
      "reviewStatus": "verified"
    },
    {
      "sourceId": "SRC-VPR-20220701",
      "sourceType": "ordinance",
      "title": "Verordnung über die politischen Rechte, SR 161.11",
      "authority": "Schweizerische Eidgenossenschaft",
      "url": "https://www.fedlex.admin.ch/eli/cc/1978/712_712_712/de",
      "documentVersionDate": "2022-07-01",
      "reviewedOn": "2026-08-30",
      "reviewStatus": "verified"
    },
    {
      "sourceId": "SRC-BGG-20260401",
      "sourceType": "statute",
      "title": "Bundesgerichtsgesetz, SR 173.110",
      "authority": "Schweizerische Eidgenossenschaft",
      "url": "https://www.fedlex.admin.ch/eli/cc/2006/218/de",
      "documentVersionDate": "2026-04-01",
      "reviewedOn": "2026-08-30",
      "reviewStatus": "verified"
    },
    {
      "sourceId": "SRC-ATSG-20240101",
      "sourceType": "statute",
      "title": "Allgemeiner Teil des Sozialversicherungsrechts, SR 830.1",
      "authority": "Schweizerische Eidgenossenschaft",
      "url": "https://www.fedlex.admin.ch/eli/cc/2002/510/de",
      "documentVersionDate": "2024-01-01",
      "reviewedOn": "2026-08-30",
      "reviewStatus": "verified"
    },
    {
      "sourceId": "SRC-VWVG-20220701",
      "sourceType": "statute",
      "title": "Verwaltungsverfahrensgesetz, SR 172.021",
      "authority": "Schweizerische Eidgenossenschaft",
      "url": "https://www.fedlex.admin.ch/eli/cc/1969/737_757_755/de",
      "documentVersionDate": "2022-07-01",
      "reviewedOn": "2026-08-30",
      "reviewStatus": "verified"
    },
    {
      "sourceId": "JUD-BGER-9C-757-2007",
      "sourceType": "caseLaw",
      "title": "BGer 9C_757/2007 vom 3. Januar 2008",
      "authority": "Bundesgericht",
      "url": "https://mcp.opencaselaw.ch/entscheid/bger_9C_757_2007#e-3",
      "documentVersionDate": "2008-01-03",
      "reviewedOn": "2026-08-30",
      "reviewStatus": "verified"
    },
    {
      "sourceId": "JUD-BGER-8C-620-2007",
      "sourceType": "caseLaw",
      "title": "BGer 8C_620/2007 vom 9. Juni 2008",
      "authority": "Bundesgericht",
      "url": "https://mcp.opencaselaw.ch/entscheid/bger_8C_620_2007#e-3-3",
      "documentVersionDate": "2008-06-09",
      "reviewedOn": "2026-08-30",
      "reviewStatus": "verified"
    },
    {
      "sourceId": "JUD-BE-VG-100-2016-347",
      "sourceType": "caseLaw",
      "title": "VGer BE 100.2016.347U vom 29. Juni 2017, BVR 2017 S. 459",
      "authority": "Verwaltungsgericht des Kantons Bern",
      "url": "https://entscheidsuche.ch/docs/BE_Verwaltungsgericht/BE_VG_001_100-2016-347_2017-06-29.pdf",
      "documentVersionDate": "2017-06-29",
      "reviewedOn": "2026-08-30",
      "reviewStatus": "verified"
    },
    {
      "sourceId": "JUD-BE-VG-100-2017-270",
      "sourceType": "caseLaw",
      "title": "VGer BE 100.2017.270 vom 12. Dezember 2017",
      "authority": "Verwaltungsgericht des Kantons Bern",
      "url": "https://entscheidsuche.ch/docs/BE_Verwaltungsgericht/BE_VG_001_100-2017-270_2017-12-12.pdf",
      "documentVersionDate": "2017-12-12",
      "reviewedOn": "2026-08-30",
      "reviewStatus": "verified"
    },
    {
      "sourceId": "JUD-BE-VG-100-2021-189",
      "sourceType": "caseLaw",
      "title": "VGer BE 100.2021.189U vom 22. Oktober 2021, BVR 2022 S. 5",
      "authority": "Verwaltungsgericht des Kantons Bern",
      "url": "https://mcp.opencaselaw.ch/entscheid/be_verwaltungsgericht_100_2021_189",
      "documentVersionDate": "2021-10-22",
      "reviewedOn": "2026-08-30",
      "reviewStatus": "verified"
    },
    {
      "sourceId": "JUD-BGER-1C-275-2009",
      "sourceType": "caseLaw",
      "title": "BGer 1C_275/2009 vom 1. Oktober 2009",
      "authority": "Bundesgericht",
      "url": "https://mcp.opencaselaw.ch/entscheid/bger_1C_275_2009#e-3-3-2",
      "documentVersionDate": "2009-10-01",
      "reviewedOn": "2026-08-30",
      "reviewStatus": "verified"
    },
    {
      "sourceId": "SRC-PRG-MATERIALS-2018",
      "sourceType": "officialDossier",
      "title": "Vortrag des Regierungsrates zur PRG-Revision 2018",
      "authority": "Regierungsrat des Kantons Bern",
      "url": "https://www.rrgr-service.apps.be.ch/api/rr/documents/document/b784c1f0933d4f629bc0fed1a4cd78ae-332/6/2016.STA.10699-vortrag-04.04.2018-de.pdf",
      "documentVersionDate": "2018-04-04",
      "reviewedOn": "2026-08-30",
      "reviewStatus": "verified"
    },
    {
      "sourceId": "SRC-RRB-498-2024",
      "sourceType": "officialDossier",
      "title": "RRB Nr. 498/2024, Regierungsstatthalter-Ersatzwahl Emmental",
      "authority": "Regierungsrat des Kantons Bern",
      "url": "https://www.rrgr-service.apps.be.ch/api/rr/documents/document/aee15674d95b4e61b5affa25eefd4d69-332/9/2024.STA.698-RRB-DF-286698.pdf",
      "documentVersionDate": "2024-05-22",
      "reviewedOn": "2026-08-30",
      "reviewStatus": "verified"
    },
    {
      "sourceId": "SRC-AP17C-ATSG-20240101",
      "sourceType": "statute",
      "title": "ATSG, AP17C-Quellenkette",
      "authority": "Schweizerische Eidgenossenschaft",
      "url": "https://www.fedlex.admin.ch/eli/cc/2002/510/20240101/de",
      "documentVersionDate": "2024-01-01",
      "reviewedOn": "2026-09-12",
      "reviewStatus": "verified"
    },
    {
      "sourceId": "SRC-AP17C-IVG-20260101",
      "sourceType": "statute",
      "title": "IVG, AP17C-Quellenkette",
      "authority": "Schweizerische Eidgenossenschaft",
      "url": "https://www.fedlex.admin.ch/eli/cc/1959/827_857_845/20260101/de",
      "documentVersionDate": "2026-01-01",
      "reviewedOn": "2026-09-12",
      "reviewStatus": "verified"
    },
    {
      "sourceId": "SRC-AP17C-AHVG-20260101",
      "sourceType": "statute",
      "title": "AHVG, AP17C-Quellenkette",
      "authority": "Schweizerische Eidgenossenschaft",
      "url": "https://www.fedlex.admin.ch/eli/cc/63/837_843_843/20260101/de",
      "documentVersionDate": "2026-01-01",
      "reviewedOn": "2026-09-12",
      "reviewStatus": "verified"
    },
    {
      "sourceId": "SRC-AP17C-UVG-20260101",
      "sourceType": "statute",
      "title": "UVG, AP17C-Quellenkette",
      "authority": "Schweizerische Eidgenossenschaft",
      "url": "https://www.fedlex.admin.ch/eli/cc/1982/1676_1676_1676/20260101/de",
      "documentVersionDate": "2026-01-01",
      "reviewedOn": "2026-09-12",
      "reviewStatus": "verified"
    },
    {
      "sourceId": "SRC-AP17C-IVV-20250601",
      "sourceType": "ordinance",
      "title": "IVV, AP17C-Quellenkette",
      "authority": "Schweizerische Eidgenossenschaft",
      "url": "https://www.fedlex.admin.ch/eli/cc/1961/29_29_29/20250601/de",
      "documentVersionDate": "2025-06-01",
      "reviewedOn": "2026-09-12",
      "reviewStatus": "verified"
    },
    {
      "sourceId": "SRC-AP17C-VRPG-BE-20260901",
      "sourceType": "statute",
      "title": "VRPG-BE, AP17C-Quellenkette",
      "authority": "Kanton Bern",
      "url": "https://www.belex.sites.be.ch/api/de/versions/3424/pdf_file",
      "documentVersionDate": "2026-09-01",
      "reviewedOn": "2026-09-12",
      "reviewStatus": "verified"
    },
    {
      "sourceId": "SRC-AP17C-FRG-BE-20210401",
      "sourceType": "statute",
      "title": "FRG-BE, AP17C-Quellenkette",
      "authority": "Kanton Bern",
      "url": "https://www.belex.sites.be.ch/api/de/versions/2234/pdf_file",
      "documentVersionDate": "2021-04-01",
      "reviewedOn": "2026-09-12",
      "reviewStatus": "verified"